{
  "profile": "VATE-AL2-Verifier-Admission-v0.2",
  "phase": "post_execution_receipt_issued",
  "transaction_id": "txn-20260504-001",
  "assurance_level": "AL2",
  "admission_receipt": {
    "type": "admission_receipt",
    "uri": "https://verifier.example/vate/admission-receipts/admrec-20260504-attenuate-001",
    "media_type": "application/vate-admission-receipt+json",
    "digest": {
      "alg": "sha-256",
      "value": "02628c006e04d55f3d7823254f033ddd3e203c3b5f3c0ccd7bbdb3d777bb9de1"
    }
  },
  "post_execution_receipt": {
    "type": "post_execution_receipt",
    "uri": "https://agent.example/vate/post-execution-receipts/postrec-20260504-001",
    "media_type": "application/vate-post-execution-receipt+json",
    "digest": {
      "alg": "sha-256",
      "value": "f4047986e0b26a69f466924bf72c8292c4504fd9cae4aa3e4209d0df07f73423"
    }
  },
  "issuer": "did:web:agent.example",
  "issued_at": "2026-05-04T03:02:31Z"
}
